genres,keywords,original_language,overview,tagline,title,vote_average,combined_text
"Drama, Comedy, Crime","holiday, elves, christmas party, department store, safe, drink, little people, christmas eve, christmas",en,"A miserable conman and his partner pose as Santa and his Little Helper to rob department stores on Christmas Eve. But they run into problems when the conman befriends a troubled kid, and the security boss discovers the plot.",He doesn't care if you're naughty or nice.,Bad Santa,6.5,"Bad Santa A miserable conman and his partner pose as Santa and his Little Helper to rob department stores on Christmas Eve. But they run into problems when the conman befriends a troubled kid, and the security boss discovers the plot. He doesn't care if you're naughty or nice. Drama, Comedy, Crime holiday, elves, christmas party, department store, safe, drink, little people, christmas eve, christmas"
"Drama, Comedy","slacker, basement, destiny, glue, stoner, wrong number, mumblecore",en,"Dispatched from his basement room on an errand for his mother, slacker Jeff might discover his destiny (finally) when he spends the day with his brother as he tracks his possibly adulterous wife.",The first step to finding your destiny is leaving your mother's basement.,"Jeff, Who Lives at Home",6.1,"Jeff, Who Lives at Home Dispatched from his basement room on an errand for his mother, slacker Jeff might discover his destiny (finally) when he spends the day with his brother as he tracks his possibly adulterous wife. The first step to finding your destiny is leaving your mother's basement. Drama, Comedy slacker, basement, destiny, glue, stoner, wrong number, mumblecore"
Comedy,"independent film, neighbor, masturbation, phone sex, actress",en,"Girl 6 is a 1996 American film by director Spike Lee about a phone sex operator. Theresa Randle played the title character, and playwright Suzan-Lori Parks wrote the screenplay. The soundtrack is composed entirely of songs written by Prince. The film was screened in the Un Certain Regard section at the 1996 Cannes Film Festival. Directors Quentin Tarantino and Ron Silver make cameo appearances as film directors at a pair of interesting auditions.","A fresh, sassy and sexy comedy!",Girl 6,5.7,"Girl 6 Girl 6 is a 1996 American film by director Spike Lee about a phone sex operator. Theresa Randle played the title character, and playwright Suzan-Lori Parks wrote the screenplay. The soundtrack is composed entirely of songs written by Prince. The film was screened in the Un Certain Regard section at the 1996 Cannes Film Festival. Directors Quentin Tarantino and Ron Silver make cameo appearances as film directors at a pair of interesting auditions. A fresh, sassy and sexy comedy! Comedy independent film, neighbor, masturbation, phone sex, actress"
"Adventure, Comedy, Family, Science Fiction","bureaucracy, england, dolphin, android, based on novel, chase, space travel, galaxy, spaceship, alien, stop motion, survival, hitchhiker, robot, alien invasion, everyman, hyperspace, meaning of life, based on radio show, alien attack, bathrobe, destruction of earth, intergalactic travel, islington england, talking robot",en,"Mere seconds before the Earth is to be demolished by an alien construction crew, Arthur Dent is swept off the planet by his friend Ford Prefect, a researcher penning a new edition of ""The Hitchhiker's Guide to the Galaxy.""",Don't leave Earth without it.,The Hitchhiker's Guide to the Galaxy,6.6,"The Hitchhiker's Guide to the Galaxy Mere seconds before the Earth is to be demolished by an alien construction crew, Arthur Dent is swept off the planet by his friend Ford Prefect, a researcher penning a new edition of ""The Hitchhiker's Guide to the Galaxy."" Don't leave Earth without it. Adventure, Comedy, Family, Science Fiction bureaucracy, england, dolphin, android, based on novel, chase, space travel, galaxy, spaceship, alien, stop motion, survival, hitchhiker, robot, alien invasion, everyman, hyperspace, meaning of life, based on radio show, alien attack, bathrobe, destruction of earth, intergalactic travel, islington england, talking robot"
"Action, History, Drama","warrior woman, number in title",en,"The aging Zhao embarks on his final and greatest campaign, a road to adventure that will crown his name in glory for all time.",,Three Kingdoms: Resurrection of the Dragon,6.6,"Three Kingdoms: Resurrection of the Dragon The aging Zhao embarks on his final and greatest campaign, a road to adventure that will crown his name in glory for all time.  Action, History, Drama warrior woman, number in title"
"Family, Fantasy","chocolate, factory worker, based on novel, candy, tv addicted person, overweight child, grandfather grandson relationship, factory, musical, single, teacher",en,Eccentric candy man Willy Wonka prompts a worldwide frenzy when he announces that golden tickets hidden inside five of his delicious candy bars will admit their lucky holders into his top-secret confectionary. But does Wonka have an agenda hidden amid a world of Oompa Loompas and chocolate rivers?,It's Scrumdiddlyumptious!,Willy Wonka & the Chocolate Factory,7.4,"Willy Wonka & the Chocolate Factory Eccentric candy man Willy Wonka prompts a worldwide frenzy when he announces that golden tickets hidden inside five of his delicious candy bars will admit their lucky holders into his top-secret confectionary. But does Wonka have an agenda hidden amid a world of Oompa Loompas and chocolate rivers? It's Scrumdiddlyumptious! Family, Fantasy chocolate, factory worker, based on novel, candy, tv addicted person, overweight child, grandfather grandson relationship, factory, musical, single, teacher"
"Action, Comedy, Thriller",gadfly,en,"The story of how a mysterious suitcase brings together, and changes, the lives of a divorced dad, an unhappy housewife, two hitmen, a pair of street thugs, two love struck teens, two FBI men and a psychedelic toad. Based on Pulitzer Prize-winning humorist Dave Barry's best-selling first novel, ""Big Trouble.""",They have forty-five minutes to save the world. They need forty-six.,Big Trouble,6.3,"Big Trouble The story of how a mysterious suitcase brings together, and changes, the lives of a divorced dad, an unhappy housewife, two hitmen, a pair of street thugs, two love struck teens, two FBI men and a psychedelic toad. Based on Pulitzer Prize-winning humorist Dave Barry's best-selling first novel, ""Big Trouble."" They have forty-five minutes to save the world. They need forty-six. Action, Comedy, Thriller gadfly"
"Horror, Mystery, Thriller","loss of family, drug addiction, jack the ripper",en,Frederick Abberline is an opium-huffing inspector from Scotland Yard who falls for one of Jack the Ripper's prostitute targets in this Hughes brothers adaption of a graphic novel that posits the Ripper's true identity.,Only the legend will survive.,From Hell,6.6,"From Hell Frederick Abberline is an opium-huffing inspector from Scotland Yard who falls for one of Jack the Ripper's prostitute targets in this Hughes brothers adaption of a graphic novel that posits the Ripper's true identity. Only the legend will survive. Horror, Mystery, Thriller loss of family, drug addiction, jack the ripper"
"Horror, Mystery","witch, voodoo, legend, sorcery, maryland, forest, footage, horror, true, student, lost, found footage, film",en,"In October of 1994 three student filmmakers disappeared in the woods near Burkittsville, Maryland, while shooting a documentary. A year later their footage was found.",The scariest movie of all time is a true story.,The Blair Witch Project,6.3,"The Blair Witch Project In October of 1994 three student filmmakers disappeared in the woods near Burkittsville, Maryland, while shooting a documentary. A year later their footage was found. The scariest movie of all time is a true story. Horror, Mystery witch, voodoo, legend, sorcery, maryland, forest, footage, horror, true, student, lost, found footage, film"
"Music, Drama","biography, based on play",en,"From director Clint Eastwood comes the big-screen version of the Tony Award-winning musical Jersey Boys. The film tells the story of four young men from the wrong side of the tracks in New Jersey who came together to form the iconic 1960s rock group The Four Seasons. The story of their trials and triumphs are accompanied by the songs that influenced a generation, including “Sherry,” “Big Girls Don’t Cry,” “Walk Like a Man,” “Rag Doll,” and many more.",,Jersey Boys,6.8,"Jersey Boys From director Clint Eastwood comes the big-screen version of the Tony Award-winning musical Jersey Boys. The film tells the story of four young men from the wrong side of the tracks in New Jersey who came together to form the iconic 1960s rock group The Four Seasons. The story of their trials and triumphs are accompanied by the songs that influenced a generation, including “Sherry,” “Big Girls Don’t Cry,” “Walk Like a Man,” “Rag Doll,” and many more.  Music, Drama biography, based on play"
"Drama, Mystery, Thriller","servant, money, shooting party",en,"Multiple storylined drama set in 1932, showing the lives of upstairs guest and downstairs servants at a party in a country house in England.",Tea at four. Dinner at eight. Murder at midnight.,Gosford Park,6.8,"Gosford Park Multiple storylined drama set in 1932, showing the lives of upstairs guest and downstairs servants at a party in a country house in England. Tea at four. Dinner at eight. Murder at midnight. Drama, Mystery, Thriller servant, money, shooting party"
Comedy,,en,"The Original Kings of Comedy achieves the seemingly impossible task of capturing the rollicking and sly comedy routines of stand-up and sitcom vets Steve Harvey, D.L. Hughley, Cedric the Entertainer, and Bernie Mac and the magic of experiencing a live concert show. Director Spike Lee and his crew plant a multitude of cameras in a packed stadium and onstage (as well as backstage, as they follow the comedians) to catch the vivid immediacy of the show, which is as much about the audience as it is about the jokes.",We Got Jokes,The Original Kings of Comedy,6.3,"The Original Kings of Comedy The Original Kings of Comedy achieves the seemingly impossible task of capturing the rollicking and sly comedy routines of stand-up and sitcom vets Steve Harvey, D.L. Hughley, Cedric the Entertainer, and Bernie Mac and the magic of experiencing a live concert show. Director Spike Lee and his crew plant a multitude of cameras in a packed stadium and onstage (as well as backstage, as they follow the comedians) to catch the vivid immediacy of the show, which is as much about the audience as it is about the jokes. We Got Jokes Comedy "
Action,"blacksmith, brothel, femme fatale, violence, ancient china, crossbow, duringcreditsstinger, lens flare, feudality",en,"In feudal China, a blacksmith who makes weapons for a small village is put in the position where he must defend himself and his fellow villagers.",You can't spell Kung Fu without F and U!,The Man with the Iron Fists,5.2,"The Man with the Iron Fists In feudal China, a blacksmith who makes weapons for a small village is put in the position where he must defend himself and his fellow villagers. You can't spell Kung Fu without F and U! Action blacksmith, brothel, femme fatale, violence, ancient china, crossbow, duringcreditsstinger, lens flare, feudality"
"Comedy, Drama","childhood memory, uniform, independent film, private, tryst",en,"Based on the true childhood experiences of Noah Baumbach and his brother, The Squid and the Whale tells the touching story of two young boys dealing with their parents divorce in Brooklyn in the 1980's.",Joint custody blows.,The Squid and the Whale,6.9,"The Squid and the Whale Based on the true childhood experiences of Noah Baumbach and his brother, The Squid and the Whale tells the touching story of two young boys dealing with their parents divorce in Brooklyn in the 1980's. Joint custody blows. Comedy, Drama childhood memory, uniform, independent film, private, tryst"
"Comedy, Romance","black people, jealousy, parents-in-law, trouble, fiancée",en,"The fiancé of an African-American woman who's met with skepticism and suspicion from her father when she takes him home for the all-important introduction. As the wedding approaches, Dad must come to terms with his future son-in-law.",His house. His rules. Some in-laws were made to be broken.,Guess Who,5.5,"Guess Who The fiancé of an African-American woman who's met with skepticism and suspicion from her father when she takes him home for the all-important introduction. As the wedding approaches, Dad must come to terms with his future son-in-law. His house. His rules. Some in-laws were made to be broken. Comedy, Romance black people, jealousy, parents-in-law, trouble, fiancée"
"Action, Crime, Drama, Thriller","revenge, murder, police corruption, violence, corrupt politician, barber, governer",en,A man is out for justice after a group of corrupt police officers are unable to catch his wife's killer.,I lay my vengeance upon them.,I Am Wrath,4.5,"I Am Wrath A man is out for justice after a group of corrupt police officers are unable to catch his wife's killer. I lay my vengeance upon them. Action, Crime, Drama, Thriller revenge, murder, police corruption, violence, corrupt politician, barber, governer"
"Horror, Thriller, Science Fiction","suicide, male nudity, female nudity, fire, nudity, asylum, telekinesis, high school, swimming pool, party, sequel, murder, prom, teacher, decapitation, blood, splatter, weightlifting, teen suicide, woman director",en,"After the suicide of her only friend, Rachel has never felt more on the outside. The one person who reached out to her, Jessie, also happens to be part of the popular crowd that lives to torment outsiders like her. But Rachel has something else that separates her from the rest, a secret amazing ability to move things with her mind. Sue Snell, the only survivor of Carrie White's rampage twenty-two years ago, may hold the key to helping Rachel come to terms with her awesome, but unwanted power. But as Rachel slowly learns to trust, a terrible trap is being laid for her. And making her angry could prove to be fatal.",Looks Can Kill,The Rage: Carrie 2,5.1,"The Rage: Carrie 2 After the suicide of her only friend, Rachel has never felt more on the outside. The one person who reached out to her, Jessie, also happens to be part of the popular crowd that lives to torment outsiders like her. But Rachel has something else that separates her from the rest, a secret amazing ability to move things with her mind. Sue Snell, the only survivor of Carrie White's rampage twenty-two years ago, may hold the key to helping Rachel come to terms with her awesome, but unwanted power. But as Rachel slowly learns to trust, a terrible trap is being laid for her. And making her angry could prove to be fatal. Looks Can Kill Horror, Thriller, Science Fiction suicide, male nudity, female nudity, fire, nudity, asylum, telekinesis, high school, swimming pool, party, sequel, murder, prom, teacher, decapitation, blood, splatter, weightlifting, teen suicide, woman director"
Drama,"suicide, gambling, manager, alcohol, based on novel, bar, billard, hustler, sport, party, pool, money, game, drunk, player",en,Fast Eddie Felson is a small-time pool hustler with a lot of talent but a self-destructive attitude. His bravado causes him to challenge the legendary Minnesota Fats to a high-stakes match.,They called him Fast Eddie. He was a winner. He was a loser. He was a hustler.,The Hustler,7.6,"The Hustler Fast Eddie Felson is a small-time pool hustler with a lot of talent but a self-destructive attitude. His bravado causes him to challenge the legendary Minnesota Fats to a high-stakes match. They called him Fast Eddie. He was a winner. He was a loser. He was a hustler. Drama suicide, gambling, manager, alcohol, based on novel, bar, billard, hustler, sport, party, pool, money, game, drunk, player"
"Comedy, Family","torture, aftercreditsstinger, duringcreditsstinger, 3d",en,The ongoing war between the canine and feline species is put on hold when they join forces to thwart a rogue cat spy with her own sinister plans for conquest.,Just like real spies... only furrier.,Cats & Dogs 2 : The Revenge of Kitty Galore,4.9,"Cats & Dogs 2 : The Revenge of Kitty Galore The ongoing war between the canine and feline species is put on hold when they join forces to thwart a rogue cat spy with her own sinister plans for conquest. Just like real spies... only furrier. Comedy, Family torture, aftercreditsstinger, duringcreditsstinger, 3d"
"Comedy, Drama, Romance","depression, toscana, recreation, author, divorce, woman director",en,"After a rough divoce, Frances, a 35 year old book editor from San Francisco takes a tour of Tuscany at the urgings of her friends. On a whim she buys Bramasole, a run down villa in the Tuscan countryside and begins to piece her life together starting with the villa and finds that life sometimes has unexpected ways of giving her everything she wanted.",Life offers you a thousand chances ... all you have to do is take one.,Under the Tuscan Sun,6.4,"Under the Tuscan Sun After a rough divoce, Frances, a 35 year old book editor from San Francisco takes a tour of Tuscany at the urgings of her friends. On a whim she buys Bramasole, a run down villa in the Tuscan countryside and begins to piece her life together starting with the villa and finds that life sometimes has unexpected ways of giving her everything she wanted. Life offers you a thousand chances ... all you have to do is take one. Comedy, Drama, Romance depression, toscana, recreation, author, divorce, woman director"
"Horror, Thriller","sunrise, winter, vampire, marriage crisis, alaska, based on graphic novel, blizzard, blood lust, polar night",en,"This is the story of an isolated Alaskan town that is plunged into darkness for a month each year when the sun sinks below the horizon. As the last rays of light fade, the town is attacked by a bloodthirsty gang of vampires bent on an uninterrupted orgy of destruction. Only the small town's husband-and-wife Sheriff team stand between the survivors and certain destruction.",They're Coming!,30 Days of Night,6.2,"30 Days of Night This is the story of an isolated Alaskan town that is plunged into darkness for a month each year when the sun sinks below the horizon. As the last rays of light fade, the town is attacked by a bloodthirsty gang of vampires bent on an uninterrupted orgy of destruction. Only the small town's husband-and-wife Sheriff team stand between the survivors and certain destruction. They're Coming! Horror, Thriller sunrise, winter, vampire, marriage crisis, alaska, based on graphic novel, blizzard, blood lust, polar night"
"Drama, Romance","farewell, responsability, dying and death, night shift, daughter, secret love, mother daughter relationship, woman director",en,A Pedro Almodovar production in which a fatally ill mother with only two months to live creates a list of things she wants to do before she dies with out telling her family of her illness.,,My Life Without Me,7.2,"My Life Without Me A Pedro Almodovar production in which a fatally ill mother with only two months to live creates a list of things she wants to do before she dies with out telling her family of her illness.  Drama, Romance farewell, responsability, dying and death, night shift, daughter, secret love, mother daughter relationship, woman director"
"Drama, Comedy","aunt, duringcreditsstinger",en,"When Madea catches sixteen-year-old Jennifer and her two younger brothers looting her home, she decides to take matters into her own hands and delivers the young delinquents to the only relative they have: their aunt April. A heavy-drinking nightclub singer who lives off of Raymond, her married boyfriend, April wants nothing to do with the kids.",,I Can Do Bad All By Myself,6.0,"I Can Do Bad All By Myself When Madea catches sixteen-year-old Jennifer and her two younger brothers looting her home, she decides to take matters into her own hands and delivers the young delinquents to the only relative they have: their aunt April. A heavy-drinking nightclub singer who lives off of Raymond, her married boyfriend, April wants nothing to do with the kids.  Drama, Comedy aunt, duringcreditsstinger"
"Action, Comedy, Music, Romance, Western","musical, annie oakley, sharpshooter",en,"This film adaptation of Irving Berlin's classic musical stars Betty Hutton as gunslinger Annie Oakley, who romances fellow sharpshooter Frank Butler (Howard Keel) as they travel with Buffalo Bill's Wild West Show. Previously off target when it comes to love, Annie proves you can get a man with a gun in this battle-of-the-sexes extravaganza, which features timeless numbers like ""Anything You Can Do"" and ""There's No Business Like Show Business.""",,Annie Get Your Gun,7.3,"Annie Get Your Gun This film adaptation of Irving Berlin's classic musical stars Betty Hutton as gunslinger Annie Oakley, who romances fellow sharpshooter Frank Butler (Howard Keel) as they travel with Buffalo Bill's Wild West Show. Previously off target when it comes to love, Annie proves you can get a man with a gun in this battle-of-the-sexes extravaganza, which features timeless numbers like ""Anything You Can Do"" and ""There's No Business Like Show Business.""  Action, Comedy, Music, Romance, Western musical, annie oakley, sharpshooter"
Comedy,"profession, karate, daughter, beförderung, ex-wife, parking, slap",en,"When underappreciated video specialist Joe Scheffer is brutally humiliated by the office bully Mark McKinney in front of his daughter, Joe begins a quest for personal redemption. He proceeds by enduring a personal make-over and takes martial arts lessons from a B-action star. As news spreads of his rematch with Mark, Joe suddenly finds himself the center of attention, ascending the corporate ladder and growing in popularity. He's determined to show everyone in his life that he is not a nobody, but a force to be reckoned with.",Someone just picked on the wrong nobody.,Joe Somebody,5.5,"Joe Somebody When underappreciated video specialist Joe Scheffer is brutally humiliated by the office bully Mark McKinney in front of his daughter, Joe begins a quest for personal redemption. He proceeds by enduring a personal make-over and takes martial arts lessons from a B-action star. As news spreads of his rematch with Mark, Joe suddenly finds himself the center of attention, ascending the corporate ladder and growing in popularity. He's determined to show everyone in his life that he is not a nobody, but a force to be reckoned with. Someone just picked on the wrong nobody. Comedy profession, karate, daughter, beförderung, ex-wife, parking, slap"
Drama,"judge, jurors, sultriness, death penalty, father murder, puerto rican, anonymity, court case, heat, group, class, innocence, court, courtroom",en,"The defense and the prosecution have rested and the jury is filing into the jury room to decide if a young Spanish-American is guilty or innocent of murdering his father. What begins as an open and shut case soon becomes a mini-drama of each of the jurors' prejudices and preconceptions about the trial, the accused, and each other.",Life is in their hands. Death is on their minds.,12 Angry Men,8.2,"12 Angry Men The defense and the prosecution have rested and the jury is filing into the jury room to decide if a young Spanish-American is guilty or innocent of murdering his father. What begins as an open and shut case soon becomes a mini-drama of each of the jurors' prejudices and preconceptions about the trial, the accused, and each other. Life is in their hands. Death is on their minds. Drama judge, jurors, sultriness, death penalty, father murder, puerto rican, anonymity, court case, heat, group, class, innocence, court, courtroom"
"Drama, Thriller","journalist, biography, internet, information leak, activist",en,"A look at the relationship between WikiLeaks founder Julian Assange and his early supporter and eventual colleague Daniel Domscheit-Berg, and how the website's growth and influence led to an irreparable rift between the two friends.",You can't expose the world's secrets without exposing yourself,The Fifth Estate,5.7,"The Fifth Estate A look at the relationship between WikiLeaks founder Julian Assange and his early supporter and eventual colleague Daniel Domscheit-Berg, and how the website's growth and influence led to an irreparable rift between the two friends. You can't expose the world's secrets without exposing yourself Drama, Thriller journalist, biography, internet, information leak, activist"
"Action, Thriller, War","gun, oil, secret service, woman director, mina",en,"Mina, a young college student, has her life ripped away after her family is killed. When she finds out their murder was part of a botched kidnapping to return her to her real father—a terrorist in the middle east.",,Born Of War,4.1,"Born Of War Mina, a young college student, has her life ripped away after her family is killed. When she finds out their murder was part of a botched kidnapping to return her to her real father—a terrorist in the middle east.  Action, Thriller, War gun, oil, secret service, woman director, mina"
Drama,"world war ii, book, nazi germany, jewish",en,"While subjected to the horrors of WWII Germany, young Liesel finds solace by stealing books and sharing them with others. Under the stairs in her home, a Jewish refuge is being sheltered by her adoptive parents.",Courage beyond words.,The Book Thief,7.4,"The Book Thief While subjected to the horrors of WWII Germany, young Liesel finds solace by stealing books and sharing them with others. Under the stairs in her home, a Jewish refuge is being sheltered by her adoptive parents. Courage beyond words. Drama world war ii, book, nazi germany, jewish"
