genres,keywords,original_language,overview,tagline,title,vote_average,combined_text
"Action, Science Fiction, Adventure","dystopia, giant robot, giant monster, apocalypse, imax, duringcreditsstinger, 3d",en,"When legions of monstrous creatures, known as Kaiju, started rising from the sea, a war began that would take millions of lives and consume humanity's resources for years on end. To combat the giant Kaiju, a special type of weapon was devised: massive robots, called Jaegers, which are controlled simultaneously by two pilots whose minds are locked in a neural bridge. But even the Jaegers are proving nearly defenseless in the face of the relentless Kaiju. On the verge of defeat, the forces defending mankind have no choice but to turn to two unlikely heroes—a washed-up former pilot (Charlie Hunnam) and an untested trainee (Rinko Kikuchi)—who are teamed to drive a legendary but seemingly obsolete Jaeger from the past. Together, they stand as mankind's last hope against the mounting apocalypse.","To Fight Monsters, We Created Monsters",Pacific Rim,6.7,"Pacific Rim When legions of monstrous creatures, known as Kaiju, started rising from the sea, a war began that would take millions of lives and consume humanity's resources for years on end. To combat the giant Kaiju, a special type of weapon was devised: massive robots, called Jaegers, which are controlled simultaneously by two pilots whose minds are locked in a neural bridge. But even the Jaegers are proving nearly defenseless in the face of the relentless Kaiju. On the verge of defeat, the forces defending mankind have no choice but to turn to two unlikely heroes—a washed-up former pilot (Charlie Hunnam) and an untested trainee (Rinko Kikuchi)—who are teamed to drive a legendary but seemingly obsolete Jaeger from the past. Together, they stand as mankind's last hope against the mounting apocalypse. To Fight Monsters, We Created Monsters Action, Science Fiction, Adventure dystopia, giant robot, giant monster, apocalypse, imax, duringcreditsstinger, 3d"
"Comedy, Romance",,en,"Successful New York journalist and single mom Julie Davidson's (Vanessa Williams) six-year old son Jake (Jeremy Gumbs) is acting up, so she finds his sperm-donor father Paul Cooper (Kevin Daniels), who's a struggling actor and law-school drop-out.",,And Then Came Love,5.0,"And Then Came Love Successful New York journalist and single mom Julie Davidson's (Vanessa Williams) six-year old son Jake (Jeremy Gumbs) is acting up, so she finds his sperm-donor father Paul Cooper (Kevin Daniels), who's a struggling actor and law-school drop-out.  Comedy, Romance "
Drama,,en,"This is the story of a teenager named Gracie Bowen, who lives in South Orange, New Jersey, is crazy about soccer, as are her three brothers and former soccer star father. Although Gracie wants to join her brothers and father in the nightly practices, she is discouraged by everyone except her elder brother, Johnny. Her father does not believe that girls should play soccer and tells her that she is neither tough enough nor talented enough to play with the boys team. Undeterred, Gracie finds reserves of strength she never knew existed, and persists in changing everyone's beliefs in what she is capable of, including her own. She faces an uphill battle when she fights to give women the opportunity to play competitive soccer. But as the beautiful and strong person that she has always been but she also brings her family together in the face of their own tragedy.",,Gracie,6.0,"Gracie This is the story of a teenager named Gracie Bowen, who lives in South Orange, New Jersey, is crazy about soccer, as are her three brothers and former soccer star father. Although Gracie wants to join her brothers and father in the nightly practices, she is discouraged by everyone except her elder brother, Johnny. Her father does not believe that girls should play soccer and tells her that she is neither tough enough nor talented enough to play with the boys team. Undeterred, Gracie finds reserves of strength she never knew existed, and persists in changing everyone's beliefs in what she is capable of, including her own. She faces an uphill battle when she fights to give women the opportunity to play competitive soccer. But as the beautiful and strong person that she has always been but she also brings her family together in the face of their own tragedy.  Drama "
"Crime, Drama, History","president, history, conspiracy, lawyer, trial, boarding house, military tribunal, historical, union, private club",en,"Mary Surratt is the lone female charged as a co-conspirator in the assassination trial of Abraham Lincoln. As the whole nation turns against her, she is forced to rely on her reluctant lawyer to uncover the truth and save her life.",One bullet killed the President. But not one man.,The Conspirator,6.2,"The Conspirator Mary Surratt is the lone female charged as a co-conspirator in the assassination trial of Abraham Lincoln. As the whole nation turns against her, she is forced to rely on her reluctant lawyer to uncover the truth and save her life. One bullet killed the President. But not one man. Crime, Drama, History president, history, conspiracy, lawyer, trial, boarding house, military tribunal, historical, union, private club"
"Action, Adventure, Animation, Comedy, Family","china, martial arts, kung fu, village, panda, sequel, talking animal, anthropomorphism, dragon, ancient china, wuxia, woman director",en,"Continuing his ""legendary adventures of awesomeness"", Po must face two hugely epic, but different threats: one supernatural and the other a little closer to his home.",Grab destiny by the rice dumplings.,Kung Fu Panda 3,6.7,"Kung Fu Panda 3 Continuing his ""legendary adventures of awesomeness"", Po must face two hugely epic, but different threats: one supernatural and the other a little closer to his home. Grab destiny by the rice dumplings. Action, Adventure, Animation, Comedy, Family china, martial arts, kung fu, village, panda, sequel, talking animal, anthropomorphism, dragon, ancient china, wuxia, woman director"
"Mystery, Horror","witch, new england, 17th century",en,"New England in the 1630s: William and Katherine lead a devout Christian life with five children, homesteading on the edge of an impassable wilderness. When their newborn son vanishes and crops fail, the family turns on one another. Beyond their worst fears, a supernatural evil lurks in the nearby wood.",Evil takes many forms.,The Witch,6.3,"The Witch New England in the 1630s: William and Katherine lead a devout Christian life with five children, homesteading on the edge of an impassable wilderness. When their newborn son vanishes and crops fail, the family turns on one another. Beyond their worst fears, a supernatural evil lurks in the nearby wood. Evil takes many forms. Mystery, Horror witch, new england, 17th century"
"Action, Adventure, Drama",,en,"Trane is a decorated war hero just shipped home to the States from Afghanistan after the brutal murder of his wife and child back in Rockaway, Queens. Upon his return, Trane encounters his old friend Dave, who describes the new forces of crime and prostitution that have moved into their neighborhood and caused the destruction of his family.",,Rockaway,5.8,"Rockaway Trane is a decorated war hero just shipped home to the States from Afghanistan after the brutal murder of his wife and child back in Rockaway, Queens. Upon his return, Trane encounters his old friend Dave, who describes the new forces of crime and prostitution that have moved into their neighborhood and caused the destruction of his family.  Action, Adventure, Drama "
"Adventure, Action, Science Fiction","civil war, war, marvel comic, sequel, superhero, based on comic book, imax, aftercreditsstinger, duringcreditsstinger, marvel cinematic universe, 3d",en,"Following the events of Age of Ultron, the collective governments of the world pass an act designed to regulate all superhuman activity. This polarizes opinion amongst the Avengers, causing two factions to side with Iron Man or Captain America, which causes an epic battle between former allies.",Divided We Fall,Captain America: Civil War,7.1,"Captain America: Civil War Following the events of Age of Ultron, the collective governments of the world pass an act designed to regulate all superhuman activity. This polarizes opinion amongst the Avengers, causing two factions to side with Iron Man or Captain America, which causes an epic battle between former allies. Divided We Fall Adventure, Action, Science Fiction civil war, war, marvel comic, sequel, superhero, based on comic book, imax, aftercreditsstinger, duringcreditsstinger, marvel cinematic universe, 3d"
"Comedy, Family","journalist, based on novel, puppy, dog, duringcreditsstinger, columnist, animal lead",en,"A newly married couple who, in the process of starting a family, learn many of life's important lessons from their trouble-loving retriever, Marley. Packed with plenty of laughs to lighten the load, the film explores the highs and lows of marriage, maturity and confronting one's own mortality, as seen through the lens of family life with a dog.",Heel the love.,Marley & Me,6.9,"Marley & Me A newly married couple who, in the process of starting a family, learn many of life's important lessons from their trouble-loving retriever, Marley. Packed with plenty of laughs to lighten the load, the film explores the highs and lows of marriage, maturity and confronting one's own mortality, as seen through the lens of family life with a dog. Heel the love. Comedy, Family journalist, based on novel, puppy, dog, duringcreditsstinger, columnist, animal lead"
"Science Fiction, Action, Adventure","spacecraft, teleportation, space mission, parachute, time travel, black hole, supernova, prequel, warp speed, futuristic, warp engine, romulans, outer space, vulcan, alternate reality, space opera, reboot",en,"The fate of the galaxy rests in the hands of bitter rivals. One, James Kirk, is a delinquent, thrill-seeking Iowa farm boy. The other, Spock, a Vulcan, was raised in a logic-based society that rejects all emotion. As fiery instinct clashes with calm reason, their unlikely but powerful partnership is the only thing capable of leading their crew through unimaginable danger, boldly going where no one has gone before. The human adventure has begun again.",The future begins.,Star Trek,7.4,"Star Trek The fate of the galaxy rests in the hands of bitter rivals. One, James Kirk, is a delinquent, thrill-seeking Iowa farm boy. The other, Spock, a Vulcan, was raised in a logic-based society that rejects all emotion. As fiery instinct clashes with calm reason, their unlikely but powerful partnership is the only thing capable of leading their crew through unimaginable danger, boldly going where no one has gone before. The human adventure has begun again. The future begins. Science Fiction, Action, Adventure spacecraft, teleportation, space mission, parachute, time travel, black hole, supernova, prequel, warp speed, futuristic, warp engine, romulans, outer space, vulcan, alternate reality, space opera, reboot"
"Comedy, Crime","white russian, dude, bowling, vietnam veteran, carpet, nihilism, heart attack, kidnapping, lsd, marijuana, los angeles, millionaire, cowboy, ashes, impregnation, bowling team, unemployed, bowling ball, weeds",en,"Jeffrey ""The Dude"" Lebowski, a Los Angeles slacker who only wants to bowl and drink white Russians, is mistaken for another Jeffrey Lebowski, a wheelchair-bound millionaire, and finds himself dragged into a strange series of events involving nihilists, adult film producers, ferrets, errant toes, and large sums of money.",Times like these call for a Big Lebowski.,The Big Lebowski,7.8,"The Big Lebowski Jeffrey ""The Dude"" Lebowski, a Los Angeles slacker who only wants to bowl and drink white Russians, is mistaken for another Jeffrey Lebowski, a wheelchair-bound millionaire, and finds himself dragged into a strange series of events involving nihilists, adult film producers, ferrets, errant toes, and large sums of money. Times like these call for a Big Lebowski. Comedy, Crime white russian, dude, bowling, vietnam veteran, carpet, nihilism, heart attack, kidnapping, lsd, marijuana, los angeles, millionaire, cowboy, ashes, impregnation, bowling team, unemployed, bowling ball, weeds"
"Mystery, Horror","sheriff, miner, delusion, head injury, remake, slaughter, blood, aftercreditsstinger, 3d",en,"Ten years ago, a tragedy changed the town of Harmony forever. Tom Hanniger, an inexperienced coal miner, caused an accident in the tunnels that trapped and killed five men and sent the only survivor, Harry Warden, into a permanent coma. But Harry Warden wanted revenge. Exactly one year later, on Valentine’s Day, he woke up…and brutally murdered twenty-two people with a pickaxe before being killed.",He's gonna break your heart.,My Bloody Valentine,5.3,"My Bloody Valentine Ten years ago, a tragedy changed the town of Harmony forever. Tom Hanniger, an inexperienced coal miner, caused an accident in the tunnels that trapped and killed five men and sent the only survivor, Harry Warden, into a permanent coma. But Harry Warden wanted revenge. Exactly one year later, on Valentine’s Day, he woke up…and brutally murdered twenty-two people with a pickaxe before being killed. He's gonna break your heart. Mystery, Horror sheriff, miner, delusion, head injury, remake, slaughter, blood, aftercreditsstinger, 3d"
Thriller,"sheriff, rain, evacuation, armored car, crook, hoodlum",en,"Get swept up in the action as an armored car driver (Christian Slater) tries to elude a gang of thieves (led by Morgan Freeman) while a flood ravages the countryside. Hard Rain is ""a wild, thrilling, chilling action ride"" filled with close calls, uncertain loyalties and heart-stopping heroics.","In the worst storm in living memory, one guard stands between five men and three million dollars.",Hard Rain,5.5,"Hard Rain Get swept up in the action as an armored car driver (Christian Slater) tries to elude a gang of thieves (led by Morgan Freeman) while a flood ravages the countryside. Hard Rain is ""a wild, thrilling, chilling action ride"" filled with close calls, uncertain loyalties and heart-stopping heroics. In the worst storm in living memory, one guard stands between five men and three million dollars. Thriller sheriff, rain, evacuation, armored car, crook, hoodlum"
"Adventure, Animation, Drama, Family","culture clash, settler, forbidden love, colony, musical, gold rush, princess, romance, native american, animation, virginia, star crossed lovers, reference to pizarro, jamestown virginia, pug dog, cross cultural relationship, musket, animate tree, indian chief, based on folk tale, 17th century, shamanism, songs, indians vs. settlers, animal sidekick, powhatan, land claim",en,"History comes gloriously to life in Disney's epic animated tale about love and adventure in the New World. Pocahontas is a Native American woman whose father has arranged for her to marry her village's best warrior. But a vision tells her change is coming, and soon she comes face to face with it in the form of Capt. John Smith.",An American legend comes to life.,Pocahontas,6.7,"Pocahontas History comes gloriously to life in Disney's epic animated tale about love and adventure in the New World. Pocahontas is a Native American woman whose father has arranged for her to marry her village's best warrior. But a vision tells her change is coming, and soon she comes face to face with it in the form of Capt. John Smith. An American legend comes to life. Adventure, Animation, Drama, Family culture clash, settler, forbidden love, colony, musical, gold rush, princess, romance, native american, animation, virginia, star crossed lovers, reference to pizarro, jamestown virginia, pug dog, cross cultural relationship, musket, animate tree, indian chief, based on folk tale, 17th century, shamanism, songs, indians vs. settlers, animal sidekick, powhatan, land claim"
"Comedy, Drama, Foreign, Romance","musical, woman director",en,"In the Summer of 1965 a young man is filled with the life of the idyllic old pearling port Broome - fishing, hanging out with his mates and his girl. However his mother returns him to the religious mission for further schooling. After being punished for an act of youthful rebellion, he runs away from the mission on a journey that ultimately leads him back home.",Bran Nue Dae,Bran Nue Dae,5.2,"Bran Nue Dae In the Summer of 1965 a young man is filled with the life of the idyllic old pearling port Broome - fishing, hanging out with his mates and his girl. However his mother returns him to the religious mission for further schooling. After being punished for an act of youthful rebellion, he runs away from the mission on a journey that ultimately leads him back home. Bran Nue Dae Comedy, Drama, Foreign, Romance musical, woman director"
"Animation, Comedy, Family, Science Fiction","inventor, business man, robot, dishonesty",en,"Rodney Copperbottom is a young robot inventor who dreams of making the world a better place, until the evil Ratchet takes over Big Weld Industries. Now, Rodney's dreams – and those of his friends – are in danger of becoming obsolete.",You can shine no matter what you're made of.,Robots,6.0,"Robots Rodney Copperbottom is a young robot inventor who dreams of making the world a better place, until the evil Ratchet takes over Big Weld Industries. Now, Rodney's dreams – and those of his friends – are in danger of becoming obsolete. You can shine no matter what you're made of. Animation, Comedy, Family, Science Fiction inventor, business man, robot, dishonesty"
"Adventure, Action, Thriller","atomic bomb, eastern block, crocodile, secret intelligence service, kgb, snake charmer, hot air balloon, east berlin, british secret service",en,James Bond is sent to investigate after a fellow “00” agent is found dead with a priceless Farberge egg. James bond follows the mystery and uncovers a smuggling scandal and a Russian General who wants to provoke a new World War.,James Bond’s all time high.,Octopussy,6.2,"Octopussy James Bond is sent to investigate after a fellow “00” agent is found dead with a priceless Farberge egg. James bond follows the mystery and uncovers a smuggling scandal and a Russian General who wants to provoke a new World War. James Bond’s all time high. Adventure, Action, Thriller atomic bomb, eastern block, crocodile, secret intelligence service, kgb, snake charmer, hot air balloon, east berlin, british secret service"
"Comedy, Drama, Romance","work ethic, tv morning show, tv reporter",en,"A young and devoted morning television producer is hired as an executive producer on a  long-running morning show at a once-prominent but currently failing station in New York City. Eager to keep the show on air, she recruits a former news journalist and anchor who disapproves of co-hosting a show that does not deal with real news stories.",Breakfast TV just got interesting.,Morning Glory,6.1,"Morning Glory A young and devoted morning television producer is hired as an executive producer on a  long-running morning show at a once-prominent but currently failing station in New York City. Eager to keep the show on air, she recruits a former news journalist and anchor who disapproves of co-hosting a show that does not deal with real news stories. Breakfast TV just got interesting. Comedy, Drama, Romance work ethic, tv morning show, tv reporter"
"Comedy, Fantasy","witch, imprisonment, vampire, curse, fish out of water, chains, gothic, madness, old house, lost love, angry mob, 18th century, ghost, hidden room, old mansion",en,Vampire Barnabas Collins is inadvertently freed from his tomb and emerges into the very changed world of 1972. He returns to Collinwood Manor to find that his once-grand estate and family have fallen into ruin.,Every Family Has Its Demons,Dark Shadows,5.7,"Dark Shadows Vampire Barnabas Collins is inadvertently freed from his tomb and emerges into the very changed world of 1972. He returns to Collinwood Manor to find that his once-grand estate and family have fallen into ruin. Every Family Has Its Demons Comedy, Fantasy witch, imprisonment, vampire, curse, fish out of water, chains, gothic, madness, old house, lost love, angry mob, 18th century, ghost, hidden room, old mansion"
"Horror, Thriller, Crime","brother brother relationship, boat, psychopath, vacation, murder, suspense, neighbor, torture, dog, family",en,"When Ann, husband George and son Georgie arrive at their holiday home they are visited by a pair of polite and seemingly pleasant young men. Armed with deceptively sweet smiles and some golf clubs, they proceed to terrorize and torture the tight-knit clan, giving them until the next day to survive.",Let the games begin...,Funny Games,6.3,"Funny Games When Ann, husband George and son Georgie arrive at their holiday home they are visited by a pair of polite and seemingly pleasant young men. Armed with deceptively sweet smiles and some golf clubs, they proceed to terrorize and torture the tight-knit clan, giving them until the next day to survive. Let the games begin... Horror, Thriller, Crime brother brother relationship, boat, psychopath, vacation, murder, suspense, neighbor, torture, dog, family"
"Action, Comedy, Crime","bounty hunter, based on novel, romance, framed, bail jumper, woman director",en,"An unemployed lingerie buyer convinces her bail bondsman cousin to give her a shot as a bounty hunter. Her first assignment is to track down a former cop on the run for murder – the same man who broke her heart years before. With the help of some friends and the best bounty hunter in the business, she slowly learns what it takes to be a true bounty hunter.",She's looking for a few not-so-good men,One for the Money,5.3,"One for the Money An unemployed lingerie buyer convinces her bail bondsman cousin to give her a shot as a bounty hunter. Her first assignment is to track down a former cop on the run for murder – the same man who broke her heart years before. With the help of some friends and the best bounty hunter in the business, she slowly learns what it takes to be a true bounty hunter. She's looking for a few not-so-good men Action, Comedy, Crime bounty hunter, based on novel, romance, framed, bail jumper, woman director"
"Action, Crime, Fantasy","riddle, dc comics, rose, gotham city, partner, superhero, robin, broken neck, psychologist, violence, criminal, district attorney, millionaire, falling down stairs, tied up, tommy gun, beretta, knocked out, super powers, disfigurement, father figure",en,"The Dark Knight of Gotham City confronts a dastardly duo: Two-Face and the Riddler. Formerly District Attorney Harvey Dent, Two-Face believes Batman caused the courtroom accident which left him disfigured on one side. And Edward Nygma, computer-genius and former employee of millionaire Bruce Wayne, is out to get the philanthropist; as The Riddler. Former circus acrobat Dick Grayson, his family killed by Two-Face, becomes Wayne's ward and Batman's new partner Robin.","Courage now, truth always...",Batman Forever,5.2,"Batman Forever The Dark Knight of Gotham City confronts a dastardly duo: Two-Face and the Riddler. Formerly District Attorney Harvey Dent, Two-Face believes Batman caused the courtroom accident which left him disfigured on one side. And Edward Nygma, computer-genius and former employee of millionaire Bruce Wayne, is out to get the philanthropist; as The Riddler. Former circus acrobat Dick Grayson, his family killed by Two-Face, becomes Wayne's ward and Batman's new partner Robin. Courage now, truth always... Action, Crime, Fantasy riddle, dc comics, rose, gotham city, partner, superhero, robin, broken neck, psychologist, violence, criminal, district attorney, millionaire, falling down stairs, tied up, tommy gun, beretta, knocked out, super powers, disfigurement, father figure"
"Action, Thriller, Crime","female nudity, prostitute, horse race, heart, strip club, electric shock, godzilla, sequel, tourette syndrome, gang, shootout, public sex, cigarette smoking, mansion, electrocution, foot chase, surgery, taser, duringcreditsstinger, flashback, absurdism, ultraviolence",en,Chelios faces a Chinese mobster who has stolen his nearly indestructible heart and replaced it with a battery-powered ticker that requires regular jolts of electricity to keep working.,"Stay Charged, Stay Alive!",Crank: High Voltage,5.9,"Crank: High Voltage Chelios faces a Chinese mobster who has stolen his nearly indestructible heart and replaced it with a battery-powered ticker that requires regular jolts of electricity to keep working. Stay Charged, Stay Alive! Action, Thriller, Crime female nudity, prostitute, horse race, heart, strip club, electric shock, godzilla, sequel, tourette syndrome, gang, shootout, public sex, cigarette smoking, mansion, electrocution, foot chase, surgery, taser, duringcreditsstinger, flashback, absurdism, ultraviolence"
